{
  "manifest_version": 1,
  "id": "pinthis",
  "app": {
    "name": "pinthis — publish to your name",
    "version": "0.1.0",
    "author": {
      "name": "HNS.ONE",
      "handshake": "pinthis",
      "contact": "https://hns.one/"
    },
    "homepage": "https://hns.one/",
    "description": "Publish a page, a folder, or a zip to IPFS and point one of your names at it. Your name serves the content from the gateway and natively over ipfs://."
  },
  "tlds": ["pinthis"],
  "capabilities": [
    {
      "cap": "name.claim",
      "scope": "claimed-label",
      "reason": "Claim a free <you>.pinthis name to publish under."
    },
    {
      "cap": "name.list",
      "scope": "any-held-name",
      "reason": "Show the names you can publish to."
    },
    {
      "cap": "content.publish",
      "scope": "any-held-name",
      "reason": "Pin your files and point the chosen name at the result. The publish pipeline itself writes the pointer records declared below; this app never composes DNS records by hand."
    },
    {
      "cap": "dns.read",
      "scope": "any-held-name",
      "record_schema": "site_pointer",
      "reason": "Show whether a name currently has a published site."
    }
  ],
  "records": {
    "site_pointer": {
      "owner": "@",
      "type": "TXT",
      "value": {
        "template": "ipfs={cid}",
        "prefix": "ipfs=",
        "fields": {
          "cid": { "grammar": "ipfs-cid" }
        }
      },
      "limit": 1,
      "meaning": "Points the name at the published site's content hash; the gateway and ipfs:// both serve it.",
      "x-platform-reserved-tag": "The `ipfs` tag is platform-reserved (HANDSHAKE-APPS.md section 6); this manifest may declare it because content.publish routes every write through the publish pipeline that owns the pointer (publishing.services._point_zone_at), and dns_records.publish_pointer treats exactly this shape as the site pointer."
    },
    "archive_pointer": {
      "owner": "@",
      "type": "TXT",
      "value": {
        "template": "ar={txid}",
        "prefix": "ar=",
        "fields": {
          "txid": { "grammar": "arweave-txid" }
        }
      },
      "limit": 1,
      "meaning": "Permanent Arweave copy of a single-file publish; served when no IPFS pointer exists.",
      "x-platform-reserved-tag": "Same reservation as site_pointer."
    },
    "gateway_a": {
      "owner": "@",
      "type": "A",
      "value": {
        "template": "{gateway_ip}",
        "fields": {
          "gateway_ip": { "grammar": "operator-gateway-ip" }
        }
      },
      "limit": 1,
      "meaning": "Makes the name reachable in ordinary browsers by pointing it at the HNS.ONE gateway, which serves the pinned content."
    }
  },
  "ui": {
    "entry": "wildroot://publish",
    "x-note": "A first-party browser page. A third-party re-implementation would live at an origin under its own name, such as app.pinthis.hns.one."
  },
  "gateway": {
    "requires": ["one.hns.gateway.content.v1"]
  }
}
